{
  "schema": "film.review-record@1",
  "id": "rev-0123456789ab",
  "subjectDigest": "sha256:e3b98a4da31a127d4bde6e43033f66ba274cab0eb7eb1c70ec41402bf6273dd8",
  "subject": "film.transition.torn-reveal@1.0.0",
  "reviewer": "independent reviewer",
  "verdict": "accept",
  "notes": "Evidence matches the request.",
  "createdAt": "2026-10-21T00:00:00Z"
}
